{
  "policy_id": "power-policy-example-v1",
  "created_at": "2026-08-01T00:00:00+00:00",
  "expires_at": "2026-09-01T00:00:00+00:00",
  "thermal_ceiling_c": 84.0,
  "thermal_resume_c": 72.0,
  "battery_floor_percent": 20.0,
  "max_sustained_watts": 15.0,
  "allowed_nvpmodel_ids": [0, 1, 2],
  "economy_nvpmodel_id": 1,
  "performance_nvpmodel_id": 0,
  "min_telemetry_interval_seconds": 1.0,
  "min_scan_interval_seconds": 1.0,
  "max_inference_duty": 1.0
}
